{
  "$schema": "https://json-schema.org/draft/2020-12/schema",
  "type": "object",
  "required": [
    "caseId",
    "inputs",
    "expected"
  ],
  "properties": {
    "caseId": {
      "type": "string"
    },
    "description": {
      "type": "string"
    },
    "inputs": {
      "type": "object"
    },
    "expected": {
      "type": "object"
    },
    "sourceRefs": {
      "type": "array",
      "items": {
        "type": "string"
      }
    }
  }
}
